{
  "$schema": "https://json-schema.org/draft/2020-12/schema",
  "$id": "https://github.com/JakobGoelden/LearningCenter/schema/subject.schema.json",
  "title": "Subject (subjects/<id>.json)",
  "type": "object",
  "required": ["id", "name", "exam", "topics"],
  "additionalProperties": false,
  "properties": {
    "$schema": { "type": "string" },
    "id": { "$ref": "common.schema.json#/$defs/id" },
    "name": { "type": "string", "minLength": 1 },
    "short": { "type": "string", "maxLength": 12, "description": "Short label for chips, e.g. 'DB'." },
    "color": { "type": "string", "pattern": "^#[0-9a-fA-F]{6}$" },
    "notes": { "type": "string" },
    "exam": {
      "type": "object",
      "required": ["format"],
      "additionalProperties": false,
      "properties": {
        "format": { "enum": ["written", "talk", "project", "unknown"], "description": "written = written exam, talk = talk or oral exam, project = project, unknown = not known yet." },
        "date": { "$ref": "common.schema.json#/$defs/date" },
        "time": { "$ref": "common.schema.json#/$defs/time" },
        "location": { "type": "string" },
        "durationMinutes": { "type": "integer", "minimum": 1 },
        "aids": { "type": "array", "items": { "type": "string" }, "description": "Allowed aids, e.g. 'Calculator TI-30X', '1 A4 sheet'." },
        "notes": { "type": "string" }
      }
    },
    "topics": { "type": "array", "items": { "$ref": "#/$defs/topic" } },
    "chapters": {
      "type": "array",
      "description": "Optional parts of the subject (e.g. script chapters), in order. The learner switches a chapter off until the lecture has happened: its topics are then left out of quizzes, study, endless mode and the calendar.",
      "items": { "$ref": "#/$defs/chapter" }
    },
    "schedule": {
      "type": "array",
      "items": { "$ref": "#/$defs/class" },
      "description": "Weekly timetable: lectures, tutorials, labs. Taken from the university timetable."
    },
    "sheets": { "type": "array", "items": { "$ref": "#/$defs/sheet" } },
    "openItems": { "type": "array", "items": { "$ref": "#/$defs/openItem" } },
    "checks": { "type": "array", "items": { "$ref": "#/$defs/check" } }
  },
  "$defs": {
    "topic": {
      "type": "object",
      "required": ["id", "title", "status"],
      "additionalProperties": false,
      "properties": {
        "id": { "$ref": "common.schema.json#/$defs/id" },
        "title": { "type": "string", "minLength": 1 },
        "notes": { "type": "string", "description": "What the topic covers, sources, typical pitfalls. Helps the AI ask good questions." },
        "status": { "$ref": "common.schema.json#/$defs/topicStatus" },
        "due": { "$ref": "common.schema.json#/$defs/date", "description": "Next review date." },
        "intervalDays": { "type": "integer", "minimum": 0, "description": "Interval that produced 'due'." },
        "history": { "type": "array", "items": { "$ref": "#/$defs/review" } },
        "chapter": { "$ref": "common.schema.json#/$defs/id", "description": "Id of an entry of the subject's `chapters`." },
        "questions": {
          "type": "array",
          "description": "Prepared quiz questions. The app asks them without an AI (one per topic per quiz, in turn), the learner grades themselves or lets the AI grade later. Write 2–4 per topic.",
          "items": { "$ref": "#/$defs/question" }
        }
      }
    },
    "chapter": {
      "type": "object",
      "required": ["id", "title"],
      "additionalProperties": false,
      "properties": {
        "id": { "$ref": "common.schema.json#/$defs/id" },
        "title": { "type": "string", "minLength": 1 },
        "enabled": { "type": "boolean", "description": "false = not part of the learning yet. Default true. Set in the app on the subject page." }
      }
    },
    "question": {
      "type": "object",
      "required": ["id", "prompt"],
      "additionalProperties": false,
      "properties": {
        "id": { "$ref": "common.schema.json#/$defs/id", "description": "Unique within the topic." },
        "prompt": { "type": "string", "minLength": 1, "description": "The question (Markdown). Tests understanding, not recall of wording." },
        "kind": { "enum": ["why", "what-if", "explain", "apply"] },
        "answer": { "type": "string", "description": "Key points of a good answer (Markdown), shown to the learner after answering and used for grading." },
        "blocked": { "type": "boolean", "description": "The learner blocked this card: it is never asked again and a sync does not bring it back. Set by the app only." },
        "stats": {
          "type": "object",
          "description": "How the learner does with this card. Written by the app; drives the priority in endless mode, separate from the topic schedule.",
          "required": ["seen", "recent"],
          "additionalProperties": false,
          "properties": {
            "seen": { "type": "integer", "minimum": 0, "description": "Number of answers given." },
            "recent": { "type": "array", "maxItems": 5, "items": { "$ref": "common.schema.json#/$defs/score" }, "description": "Last scores, oldest first." },
            "last": { "$ref": "common.schema.json#/$defs/date", "description": "Date of the last answer." }
          }
        }
      }
    },
    "review": {
      "type": "object",
      "required": ["date", "score", "source"],
      "additionalProperties": false,
      "properties": {
        "date": { "$ref": "common.schema.json#/$defs/date" },
        "score": { "$ref": "common.schema.json#/$defs/score" },
        "source": { "enum": ["quiz", "dojo", "manual"] },
        "sessionId": { "type": "string" },
        "note": { "type": "string" }
      }
    },
    "sheet": {
      "type": "object",
      "required": ["id", "label", "status"],
      "additionalProperties": false,
      "properties": {
        "id": { "$ref": "common.schema.json#/$defs/id" },
        "label": { "type": "string", "description": "e.g. 'Sheet 3' or 'B3'." },
        "due": { "$ref": "common.schema.json#/$defs/date" },
        "status": { "enum": ["open", "done", "checked"], "description": "open = not started, done = worked on, checked = checked or graded." },
        "url": { "type": "string", "description": "Where the sheet is published, e.g. the Moodle page." },
        "file": {
          "type": "string",
          "description": "The sheet itself: a path relative to the pack folder (e.g. material/db/sheet-3.pdf) or an https link. Shown next to the editor in the app."
        },
        "tasks": {
          "type": "array",
          "items": { "$ref": "#/$defs/sheetTask" },
          "description": "The sheet's tasks as text, so they can be solved in the app one by one. Usually extracted from the PDF by the AI."
        },
        "notes": { "type": "string" }
      }
    },
    "sheetTask": {
      "type": "object",
      "required": ["id", "label", "text"],
      "additionalProperties": false,
      "properties": {
        "id": { "$ref": "common.schema.json#/$defs/id" },
        "label": { "type": "string", "description": "e.g. 'Task 1' or '2a'." },
        "text": { "type": "string", "description": "The task in Markdown." },
        "points": { "type": "number", "minimum": 0 }
      }
    },
    "class": {
      "type": "object",
      "required": ["kind", "weekday", "start", "end"],
      "additionalProperties": false,
      "properties": {
        "kind": { "enum": ["lecture", "tutorial", "lab", "seminar", "other"] },
        "weekday": { "enum": ["mon", "tue", "wed", "thu", "fri", "sat", "sun"] },
        "start": { "$ref": "common.schema.json#/$defs/time" },
        "end": { "$ref": "common.schema.json#/$defs/time" },
        "location": { "type": "string" },
        "from": { "$ref": "common.schema.json#/$defs/date", "description": "First day this class takes place, if not the whole semester." },
        "until": { "$ref": "common.schema.json#/$defs/date", "description": "Last day this class takes place." },
        "notes": { "type": "string", "description": "e.g. 'every other week', 'group B'." }
      }
    },
    "openItem": {
      "type": "object",
      "required": ["id", "text"],
      "additionalProperties": false,
      "properties": {
        "id": { "$ref": "common.schema.json#/$defs/id" },
        "text": { "type": "string", "minLength": 1 },
        "createdAt": { "$ref": "common.schema.json#/$defs/date" },
        "doneAt": { "$ref": "common.schema.json#/$defs/date" }
      }
    },
    "check": {
      "type": "object",
      "required": ["id", "kind", "label"],
      "additionalProperties": false,
      "properties": {
        "id": { "$ref": "common.schema.json#/$defs/id" },
        "kind": { "enum": ["material", "script", "notes", "other"], "description": "material = material source (e.g. Moodle), script = script version, notes = own notes." },
        "label": { "type": "string" },
        "lastChecked": { "$ref": "common.schema.json#/$defs/date" },
        "version": { "type": "string" },
        "url": { "type": "string", "description": "Where to look: a link (e.g. the Moodle course) or a path relative to the pack folder (e.g. material/db/ or notes/db/)." },
        "everyDays": { "type": "integer", "minimum": 1, "description": "Flag the check as stale after this many days." },
        "note": { "type": "string" }
      }
    }
  }
}
