{
  "$schema": "../../../schema/subject.schema.json",
  "id": "theo",
  "name": "Theoretical Computer Science",
  "short": "Theo",
  "color": "#6d5bd0",
  "exam": {
    "format": "written",
    "date": "2027-02-08",
    "time": "10:00",
    "location": "Main lecture hall",
    "durationMinutes": 120,
    "aids": ["1 handwritten A4 sheet"]
  },
  "topics": [
    {
      "id": "dfa-nfa",
      "title": "DFA and NFA",
      "notes": "Definitions, accepted language, nondeterminism, ε-transitions.",
      "status": "solid",
      "due": "2026-10-23",
      "intervalDays": 7,
      "history": [
        { "date": "2026-10-13", "score": 4, "source": "quiz" },
        { "date": "2026-10-16", "score": 5, "source": "quiz" }
      ]
    },
    {
      "id": "powerset",
      "title": "Powerset construction",
      "notes": "NFA → DFA, ε-closure, why at most 2^n states.",
      "status": "shaky",
      "due": "2026-10-14",
      "intervalDays": 1,
      "history": [{ "date": "2026-10-13", "score": 2, "source": "dojo" }]
    },
    {
      "id": "regex",
      "title": "Regular expressions",
      "notes": "Syntax, Thompson construction, state elimination DFA → regex.",
      "status": "shaky",
      "due": "2026-10-16",
      "intervalDays": 3,
      "history": [{ "date": "2026-10-13", "score": 3, "source": "quiz" }]
    },
    {
      "id": "minimization",
      "title": "DFA minimization",
      "notes": "Equivalence classes, table-filling algorithm, Myhill-Nerode.",
      "status": "new"
    },
    {
      "id": "pumping",
      "title": "Pumping lemma for regular languages",
      "notes": "Proof structure, typical mistakes when choosing w and the split.",
      "status": "new"
    },
    {
      "id": "history-of-automata",
      "title": "History of automata theory",
      "notes": "Not relevant for the exam.",
      "status": "skip"
    }
  ],
  "sheets": [
    { "id": "b1", "label": "B1", "due": "2026-10-20", "status": "checked" },
    { "id": "b2", "label": "B2", "due": "2026-10-27", "status": "done" },
    { "id": "b3", "label": "B3", "due": "2026-11-03", "status": "open" }
  ],
  "openItems": [
    { "id": "slides-vl3", "text": "Slides for lecture 3 still missing on Moodle", "createdAt": "2026-10-15" },
    { "id": "notes-vl2", "text": "Compare lecture 2 notes with the script", "createdAt": "2026-10-14" }
  ],
  "checks": [
    {
      "id": "moodle",
      "kind": "material",
      "label": "Moodle course",
      "lastChecked": "2026-10-15",
      "everyDays": 3
    },
    {
      "id": "script",
      "kind": "script",
      "label": "Script",
      "version": "v1.2",
      "lastChecked": "2026-10-12",
      "everyDays": 14
    },
    { "id": "notes", "kind": "notes", "label": "Own notes", "lastChecked": "2026-10-07", "everyDays": 7 }
  ]
}
